faq_question,count
cual es el precio de la maquina,378
donde estan ubicados,117
pueden enviar la ficha tecnica,108
tienen video del funcionamiento,83
que modelos tienen,62
cual es la capacidad de produccion,43
tienen moldes o kits,42
como es el envio,38
como puedo cotizar una maquina,35
que dimensiones tiene la maquina,20
como puedo comprar una maquina,17
cuales son las formas de pago,13
hay disponibilidad,11
como funciona la maquina de empanadas,8
tiene garantia,7
como agendar una demo,7
tienen laminadora de trigo,6
que funciones tiene la maquina,6
tienen repuestos y soporte tecnico,6
que voltaje requiere la maquina,4
cual es la maquina de empanadas mas economica,4
tienen ofertas,4
tienen opciones de financiamiento,3
cuanto se demora en llegar,3
incluye instalacion o capacitacion,2
cual es la maquina de empanadas mas economica que tienen,2
ustedes venden la maquina,2
tienen una maquina mas mecanizada,2
cual es el pedido minimo,2
la maquina viene ensamblada,2
en que lugar estas ubicado,2
tienen fotos o videos,2
hay diferentes tamanos de maquinas de empanadas,1
tienes maquinas para empanadas disponibles,1
que informacion tienes sobre la maquina cm08,1
tienen una maquina para amasar,1
cual es la maquina de empanadas mas economica que ofrecen,1
se puede usar masa de trigo para las empanadas,1
tienen puntos de venta de empanadas en su pais,1
cual es la maquina mas economica para hacer empanadas,1
viene con la mesa,1
cuales son los mantenimientos necesarios para las maquinas de empanadas,1
la maquina es solo para formar las empanadas o tambien ayuda en la elaboracion de la masa,1
venden maquinas para moler y mezclar yuca,1
tienen opciones mas economicas disponibles,1
se pueden anadir accesorios para hacer arepas,1
que presentaciones tienes disponibles,1
que maquina necesito para producir 1000 empanadas diarias,1
la maquina llega lista para funcionar,1
hay maquinas para hacer empanadas,1
venden la maquina o es solo franquicia,1
que equipos tienen ustedes,1
cual es la maquina de empanadas mas sencilla,1
que informacion hay sobre la maquina de empanadas,1
tienen todos los documentos para la facturacion de la maquina,1
tienen una maquina de empanadas mas economica,1
cual es la mejor maquina de empanadas que me recomiendas,1
por que es mas costosa la maquina de empanadas para estados unidos,1
a que horas puedo llamarlos,1
tienen maquinas que pueden hacer aborrajados,1
las maquinas que tienen son adecuadas para mis necesidades,1
que seguridad tengo de recibir mi maquina y no perder mi dinero,1
que incluye la maquina,1
cual maquina es adecuada para empanadas de hojaldre y arepas,1
esa maquina funciona con compresor,1
hacen envios solo en manizales o tambien de forma virtual,1
es virtual,1
como son las maquinas para fabricar empanadas,1
solo tienen maquinas para empanadas,1
fabrican otro tipo de maquinas,1
cual es la mejor maquina de empanadas que tienen,1
se puede hacer un curso de introduccion virtual o tiene que ser presencial,1
tienen maquinas de empanadas que utilicen solo un operario,1
cual es la mejor harina para usar en la maquinaria de empanadas,1
las maquinas de empanadas de trigo vienen con nombre,1
como puedo acceder a la presentacion del producto,1
como contacto con el equipo de ventas,1
en que horario atienden,1
cual es el horario de atencion,1
ustedes fabrican empanadas o solo los equipos,1
cuanto tiempo llevan fabricando equipos,1
cual es la maquina de empanadas mas economica para empezar,1
cuantos operarios se requieren para operar la cm05s,1
que maquina de empanadas me recomiendan para empezar a vender,1
de cuantos centimetros queda la empanada,1
con cuantas maquinas de empanadas se debe iniciar este emprendimiento,1
de que pais son las maquinas de empanadas,1
la maquina de empanadas es nacional o importada,1
la maquina prepara la masa y arma las empanadas,1
tienen maquinas de empanadas disponibles para cucuta,1
cuentan con sucursal en mexico,1
cual es la maquina de aser para empanadas,1
esta maquina solo sirve para masa de maiz,1
manejan maquina para moler la masa,1
hay maquinas de empanadas que se puedan manejar con una sola persona,1
en que pais realizan envios,1
venden las maquinas en colombia,1
hay maquinas de empanadas que puedan hacer dos tipos de productos,1
tienes maquina para empanadas de arroz,1
como hacer 200 o 300 empanadas,1
es necesario asistir de forma presencial,1
cual es la maquina mas sencilla,1
que informacion necesitas sobre la maquina,1
una maquina puede producir de maiz y de trigo,1
en que ciudad los puedo visitar,1
venden maquinas para hacer empanadas,1
que informacion tienes sobre la maquina de empanadas,1
hay que pagar algo por el cupo,1
hay una maquina para hacer empanadas y otro tipo de productos,1
que tipo de maquina de empanadas necesito para mi emprendimiento,1
cual es la marca de los componentes mecanicos y electronicos,1
que marcas manejan,1
cual es el nombre de la marca,1
el movimiento de giro del disco se hace manual,1
ustedes elaboran la maquina,1
que es la maquina de empanadas,1
que informacion necesitas sobre la maquina de empanadas,1
esa maquina funciona con cualquier tipo de masa,1
de que pais se habla,1
como se pueden ver los productos,1
hay maquinas de empanadas mas pequenas y economicas,1
puedo visitar la tienda,1
como puedo conseguir una maquina de empanadas,1
que hacer si la maquina de empanadas falla,1
cual es el servicio tecnico autorizado para la maquina de empanadas,1
ustedes venden maquinas de hacer empanadas,1
la maquina de empanadas tiene rodachines para moverla facilmente,1
desde que pais enviaran,1
tienes informacion sobre maquinas que empaquen mani,1
que equipos manejan para iniciar un negocio de empanadas automatizado,1
hacen envios a otros paises,1
tienen una pagina web,1
puedo visitar la fabrica para conocer las diferentes maquinas,1
la maquina mas economica se financia,1
que pueden ofrecer en maquinas de empanadas,1
puedo hacer arepas redondas con la maquina de empanadas,1
la presencia solo es en manizales,1
tienen un accesorio nuevo para la maquina,1
estaran en la feria de alimentos en bogota este ano,1
la maquina tambien esta a la venta,1
como son las maquinas de empanadas,1
esto es lo minimo de la maquina,1
cual es la diferencia entre esta maquina y la otra,1
tienes el producto en colombia,1
que informacion necesitas sobre las maquinas de empanadas,1
hay opciones mas economicas de maquinas de empanadas,1
que otros productos puede hacer la maquina de empanadas,1
hace mucho ruido la maquina de empanadas,1
hacen envios a el salvador,1
como funciona el proceso de llenado de empanadas en la maquina,1
cual es la funcion de la maquina de empanadas,1
tienes la maquina que se utiliza para desmechar,1
hay una maquina de empanadas mas economica para emprendimiento,1
que productos o maquinas ofreces,1
cual maquina de empanadas me recomiendas,1
se pueden fabricar pasteles de pollo con esta maquina,1
tienen maquinas de empanadas disponibles en puerto boyaca,1
cuales son las opciones de maquinas para producir empanadas de escala baja (hasta 1000/dia),1
han enviado ya a panama,1
"que tipo de maquina de empanadas debo elegir, automatica o semi automatica",1
hay que tener la masa de harina laminada o solo hay que poner la bola de masa de harina,1
tienen maquina para hacer la masa y los rellenos de las empanadas,1
hay maquinas pequenas disponibles,1
es solo para masa de maiz,1
por que las maquinas de empanadas son tan caras,1
"tienen alguna maquina de empanadas mas economica que funcione para trigo, platano y maiz",1
alguna de esas maquinas de empanadas trabaja con platano,1
tienen videos sobre como funciona la maquina de empanadas,1
vienen a la feria de bogota,1
cuales son las maquinas de empanadas mas economicas,1
tienen maquinas de empanadas pequenas,1
ustedes venden la maquina para hacer empanadas,1
la maquina viene con el compresor,1
que clase de compresor se necesita para la maquina de empanadas,1
el compresor tiene algo especial o cualquiera sirve,1
es la maquina mas pequena que tienes,1
tienen distribucion a otras ciudades,1
cual es la maquina de empanadas mas comprada,1
tienen punto de venta fisico para ver las maquinas de empanadas,1
cuanto hay que pagar para hacer el pedido,1
cual es la maquina base,1
como es su maquina de empanadas,1
tienen varios tamanos de maquinas de empanadas,1
que informacion tienen sobre la maquina de empanadas,1
tambien sirve la maquina de empanadas para pastel de yuca,1
que es la cm06b,1
puedo comunicarme con un asesor,1
se puede hacer un pedido para hoy,1
tienen amasadoras para maiz,1
tienen maquinas de empanadas de segunda mano,1
que maquina es adecuada para empanadas cocteleras y grandes al mismo tiempo,1
hay una maquina que sirva para todos los tipos de empanadas,1
se pueden hacer empanadas cocteleras,1
que informacion hay sobre la maquina de hacer empanadas,1
cual es el tiempo de coccion de las empanadas,1
venden amasadoras,1
que informacion me puede dar sobre la esmechadora de carne,1
que novedades tiene la maquina de empanadas,1
"que maquina me recomiendan para hacer empanadas, patacones y arepas",1
incluye pre fritura,1
que equipos tienes para prefitura,1
que marcas de maquinas de empanadas recomiendas,1
que incluye la compra de la maquina de empanadas,1
venden la maquina,1
que espacio ocupa la maquina de empanadas,1
sirve para desmechar carne,1
tienen maquinas para desmechar carne,1
